{
  "$schema": "https://cdn.jsdelivr.net/gh/forge-arcana/kos-data@main/schema/event.schema.json",
  "dataset": "event",
  "sport": "f1",
  "event": {
    "id": "f1/2026/wc/r08-austrian-gp",
    "name": "Formula 1 Lenovo Austrian Grand Prix 2026",
    "kind": "race",
    "season": "f1/2026",
    "venue": "venue/red-bull-ring",
    "start": "2026-06-28T12:00:00Z",
    "status": "final"
  },
  "date": "2026-06-28",
  "updated": "2026-09-07T01:31:38.415Z",
  "sources": [
    "f1db",
    "open-meteo",
    "polymarket"
  ],
  "sourcesMeta": {
    "f1db": {
      "date": "2026-06-28"
    },
    "open-meteo": {
      "date": "2026-06-28"
    },
    "polymarket": {
      "date": "2026-06-28"
    }
  },
  "entities": [
    "athlete/alexander-albon",
    "athlete/arvid-lindblad",
    "athlete/ayumu-iwasa",
    "athlete/carlos-sainz-jr",
    "athlete/charles-leclerc",
    "athlete/dino-beganovic",
    "athlete/esteban-ocon",
    "athlete/fernando-alonso",
    "athlete/franco-colapinto",
    "athlete/gabriel-bortoleto",
    "athlete/george-russell",
    "athlete/isack-hadjar",
    "athlete/jak-crawford",
    "athlete/kimi-antonelli",
    "athlete/lance-stroll",
    "athlete/lando-norris",
    "athlete/lewis-hamilton",
    "athlete/liam-lawson",
    "athlete/luke-browning",
    "athlete/max-verstappen",
    "athlete/nico-hulkenberg",
    "athlete/oliver-bearman",
    "athlete/oscar-piastri",
    "athlete/paul-aron",
    "athlete/pierre-gasly",
    "athlete/ryo-hirakawa",
    "athlete/sergio-perez",
    "athlete/valtteri-bottas"
  ],
  "rows": [
    {
      "session": "fp1",
      "entity": "athlete/alexander-albon",
      "metric": "result.position",
      "value": 16,
      "unit": "rank",
      "source": "f1db"
    },
    {
      "session": "fp1",
      "entity": "athlete/arvid-lindblad",
      "metric": "result.position",
      "value": 6,
      "unit": "rank",
      "source": "f1db"
    },
    {
      "session": "fp1",
      "entity": "athlete/ayumu-iwasa",
      "metric": "result.position",
      "value": 15,
      "unit": "rank",
      "source": "f1db"
    },
    {
      "session": "fp1",
      "entity": "athlete/dino-beganovic",
      "metric": "result.position",
      "value": 9,
      "unit": "rank",
      "source": "f1db"
    },
    {
      "session": "fp1",
      "entity": "athlete/fernando-alonso",
      "metric": "result.position",
      "value": 22,
      "unit": "rank",
      "source": "f1db"
    },
    {
      "session": "fp1",
      "entity": "athlete/franco-colapinto",
      "metric": "result.position",
      "value": 8,
      "unit": "rank",
      "source": "f1db"
    },
    {
      "session": "fp1",
      "entity": "athlete/george-russell",
      "metric": "result.position",
      "value": 2,
      "unit": "rank",
      "source": "f1db"
    },
    {
      "session": "fp1",
      "entity": "athlete/isack-hadjar",
      "metric": "result.position",
      "value": 12,
      "unit": "rank",
      "source": "f1db"
    },
    {
      "session": "fp1",
      "entity": "athlete/jak-crawford",
      "metric": "result.position",
      "value": 20,
      "unit": "rank",
      "source": "f1db"
    },
    {
      "session": "fp1",
      "entity": "athlete/kimi-antonelli",
      "metric": "result.position",
      "value": 1,
      "unit": "rank",
      "source": "f1db"
    },
    {
      "session": "fp1",
      "entity": "athlete/lando-norris",
      "metric": "result.position",
      "value": 7,
      "unit": "rank",
      "source": "f1db"
    },
    {
      "session": "fp1",
      "entity": "athlete/lewis-hamilton",
      "metric": "result.position",
      "value": 5,
      "unit": "rank",
      "source": "f1db"
    },
    {
      "session": "fp1",
      "entity": "athlete/luke-browning",
      "metric": "result.position",
      "value": 18,
      "unit": "rank",
      "source": "f1db"
    },
    {
      "session": "fp1",
      "entity": "athlete/max-verstappen",
      "metric": "result.position",
      "value": 4,
      "unit": "rank",
      "source": "f1db"
    },
    {
      "session": "fp1",
      "entity": "athlete/nico-hulkenberg",
      "metric": "result.position",
      "value": 11,
      "unit": "rank",
      "source": "f1db"
    },
    {
      "session": "fp1",
      "entity": "athlete/oliver-bearman",
      "metric": "result.position",
      "value": 10,
      "unit": "rank",
      "source": "f1db"
    },
    {
      "session": "fp1",
      "entity": "athlete/oscar-piastri",
      "metric": "result.position",
      "value": 3,
      "unit": "rank",
      "source": "f1db"
    },
    {
      "session": "fp1",
      "entity": "athlete/paul-aron",
      "metric": "result.position",
      "value": 17,
      "unit": "rank",
      "source": "f1db"
    },
    {
      "session": "fp1",
      "entity": "athlete/pierre-gasly",
      "metric": "result.position",
      "value": 14,
      "unit": "rank",
      "source": "f1db"
    },
    {
      "session": "fp1",
      "entity": "athlete/ryo-hirakawa",
      "metric": "result.position",
      "value": 19,
      "unit": "rank",
      "source": "f1db"
    },
    {
      "session": "fp1",
      "entity": "athlete/sergio-perez",
      "metric": "result.position",
      "value": 21,
      "unit": "rank",
      "source": "f1db"
    },
    {
      "session": "fp1",
      "entity": "athlete/valtteri-bottas",
      "metric": "result.position",
      "value": 13,
      "unit": "rank",
      "source": "f1db"
    },
    {
      "session": "fp2",
      "entity": "athlete/alexander-albon",
      "metric": "result.position",
      "value": 17,
      "unit": "rank",
      "source": "f1db"
    },
    {
      "session": "fp2",
      "entity": "athlete/arvid-lindblad",
      "metric": "result.position",
      "value": 12,
      "unit": "rank",
      "source": "f1db"
    },
    {
      "session": "fp2",
      "entity": "athlete/carlos-sainz-jr",
      "metric": "result.position",
      "value": 18,
      "unit": "rank",
      "source": "f1db"
    },
    {
      "session": "fp2",
      "entity": "athlete/charles-leclerc",
      "metric": "result.position",
      "value": 8,
      "unit": "rank",
      "source": "f1db"
    },
    {
      "session": "fp2",
      "entity": "athlete/esteban-ocon",
      "metric": "result.position",
      "value": 15,
      "unit": "rank",
      "source": "f1db"
    },
    {
      "session": "fp2",
      "entity": "athlete/fernando-alonso",
      "metric": "result.position",
      "value": 19,
      "unit": "rank",
      "source": "f1db"
    },
    {
      "session": "fp2",
      "entity": "athlete/franco-colapinto",
      "metric": "result.position",
      "value": 16,
      "unit": "rank",
      "source": "f1db"
    },
    {
      "session": "fp2",
      "entity": "athlete/gabriel-bortoleto",
      "metric": "result.position",
      "value": 10,
      "unit": "rank",
      "source": "f1db"
    },
    {
      "session": "fp2",
      "entity": "athlete/george-russell",
      "metric": "result.position",
      "value": 6,
      "unit": "rank",
      "source": "f1db"
    },
    {
      "session": "fp2",
      "entity": "athlete/isack-hadjar",
      "metric": "result.position",
      "value": 7,
      "unit": "rank",
      "source": "f1db"
    },
    {
      "session": "fp2",
      "entity": "athlete/kimi-antonelli",
      "metric": "result.position",
      "value": 1,
      "unit": "rank",
      "source": "f1db"
    },
    {
      "session": "fp2",
      "entity": "athlete/lance-stroll",
      "metric": "result.position",
      "value": 20,
      "unit": "rank",
      "source": "f1db"
    },
    {
      "session": "fp2",
      "entity": "athlete/lando-norris",
      "metric": "result.position",
      "value": 3,
      "unit": "rank",
      "source": "f1db"
    },
    {
      "session": "fp2",
      "entity": "athlete/lewis-hamilton",
      "metric": "result.position",
      "value": 5,
      "unit": "rank",
      "source": "f1db"
    },
    {
      "session": "fp2",
      "entity": "athlete/liam-lawson",
      "metric": "result.position",
      "value": 9,
      "unit": "rank",
      "source": "f1db"
    },
    {
      "session": "fp2",
      "entity": "athlete/max-verstappen",
      "metric": "result.position",
      "value": 4,
      "unit": "rank",
      "source": "f1db"
    },
    {
      "session": "fp2",
      "entity": "athlete/nico-hulkenberg",
      "metric": "result.position",
      "value": 14,
      "unit": "rank",
      "source": "f1db"
    },
    {
      "session": "fp2",
      "entity": "athlete/oliver-bearman",
      "metric": "result.position",
      "value": 13,
      "unit": "rank",
      "source": "f1db"
    },
    {
      "session": "fp2",
      "entity": "athlete/oscar-piastri",
      "metric": "result.position",
      "value": 2,
      "unit": "rank",
      "source": "f1db"
    },
    {
      "session": "fp2",
      "entity": "athlete/pierre-gasly",
      "metric": "result.position",
      "value": 11,
      "unit": "rank",
      "source": "f1db"
    },
    {
      "session": "fp2",
      "entity": "athlete/sergio-perez",
      "metric": "result.position",
      "value": 22,
      "unit": "rank",
      "source": "f1db"
    },
    {
      "session": "fp2",
      "entity": "athlete/valtteri-bottas",
      "metric": "result.position",
      "value": 21,
      "unit": "rank",
      "source": "f1db"
    },
    {
      "session": "fp3",
      "entity": "athlete/alexander-albon",
      "metric": "result.position",
      "value": 18,
      "unit": "rank",
      "source": "f1db"
    },
    {
      "session": "fp3",
      "entity": "athlete/arvid-lindblad",
      "metric": "result.position",
      "value": 10,
      "unit": "rank",
      "source": "f1db"
    },
    {
      "session": "fp3",
      "entity": "athlete/carlos-sainz-jr",
      "metric": "result.position",
      "value": 17,
      "unit": "rank",
      "source": "f1db"
    },
    {
      "session": "fp3",
      "entity": "athlete/charles-leclerc",
      "metric": "result.position",